{
  "$schema": "https://json-schema.org/draft/2020-12/schema",
  "$id": "https://example.invalid/agent-contract-guard/schema/handoff-v0.1.json",
  "$comment": "Provisional pre-publication identifier; unstable until a public schema origin is selected.",
  "title": "Sortie-dogs handoff v0.1",
  "type": "object",
  "additionalProperties": false,
  "required": ["version", "profile", "id", "created_at", "task", "state", "risks", "verification"],
  "properties": {
    "version": { "const": "0.1.0" },
    "profile": { "enum": ["minimal", "full"] },
    "ext": {
      "type": "object",
      "description": "Opaque extension data; validators do not lint or diagnose its contents."
    },
    "id": { "type": "string", "pattern": "^[A-Za-z0-9][A-Za-z0-9._-]{0,127}$" },
    "created_at": { "type": "string", "format": "date-time" },
    "task": {
      "type": "object",
      "additionalProperties": false,
      "required": ["title", "objective"],
      "properties": {
        "title": { "type": "string", "minLength": 1, "maxLength": 160 },
        "objective": { "type": "string", "minLength": 1, "maxLength": 32768 }
      }
    },
    "scope": {
      "type": "object",
      "additionalProperties": false,
      "required": ["paths"],
      "properties": {
        "paths": {
          "type": "array",
          "minItems": 1,
          "uniqueItems": true,
          "items": { "type": "string", "minLength": 1, "maxLength": 512 }
        },
        "excludes": {
          "type": "array",
          "uniqueItems": true,
          "items": { "type": "string", "minLength": 1, "maxLength": 512 }
        }
      }
    },
    "state": {
      "type": "object",
      "additionalProperties": false,
      "required": ["done", "next", "blocked"],
      "properties": {
        "done": { "$ref": "#/$defs/statements" },
        "next": { "$ref": "#/$defs/statements" },
        "blocked": {
          "type": "array",
          "items": {
            "type": "object",
            "additionalProperties": false,
            "required": ["reason", "needed"],
            "properties": {
              "reason": { "type": "string", "minLength": 1, "maxLength": 1000 },
              "needed": { "type": "string", "minLength": 1, "maxLength": 1000 }
            }
          }
        }
      }
    },
    "sources": {
      "type": "array",
      "minItems": 1,
      "items": {
        "type": "object",
        "additionalProperties": false,
        "required": ["path", "rev"],
        "properties": {
          "path": { "type": "string", "minLength": 1, "maxLength": 512 },
          "rev": { "type": "string", "minLength": 1, "maxLength": 256 },
          "hash": { "type": "string", "pattern": "^(sha256|sha512):[A-Fa-f0-9]+$" }
        }
      }
    },
    "risks": {
      "type": "array",
      "items": {
        "type": "object",
        "additionalProperties": false,
        "required": ["severity", "description"],
        "properties": {
          "severity": { "enum": ["low", "medium", "high"] },
          "description": { "type": "string", "minLength": 1, "maxLength": 1000 },
          "mitigation": { "type": "string", "minLength": 1, "maxLength": 1000 }
        }
      }
    },
    "verification": {
      "type": "array",
      "items": {
        "type": "object",
        "additionalProperties": false,
        "required": ["check", "status", "summary"],
        "properties": {
          "check": { "type": "string", "minLength": 1, "maxLength": 8192 },
          "status": { "enum": ["pass", "fail", "not_run"] },
          "exit_code": { "type": ["integer", "null"] },
          "summary": { "type": "string", "minLength": 1, "maxLength": 1000 }
        }
      }
    }
  },
  "allOf": [
    {
      "if": { "properties": { "profile": { "const": "full" } }, "required": ["profile"] },
      "then": { "required": ["scope", "sources"] }
    }
  ],
  "$defs": {
    "statements": {
      "type": "array",
      "items": { "type": "string", "minLength": 1, "maxLength": 1000 }
    }
  }
}
