{
  "version": "0.1.0",
  "profile": "full",
  "id": "card-u2-canonical-placement",
  "created_at": "2026-08-02T00:00:00Z",
  "task": {
    "title": "Validate canonical Mk2A2 placement",
    "objective": "Resolve the private /sortie command to the canonical coordinator while the sortie-dogs write and handoff gates are active."
  },
  "scope": {
    "paths": ["allowed.txt", "handoff.json"]
  },
  "state": {
    "done": ["Placed the private command and canonical coordinator reference, then exercised the declared gate target."],
    "next": [],
    "blocked": []
  },
  "sources": [
    {
      "path": "allowed.txt",
      "rev": "card-u2-private-validation"
    }
  ],
  "risks": [],
  "verification": [
    {
      "check": "/home/rozen/.opencode/bin/opencode debug config",
      "status": "pass",
      "exit_code": 0,
      "summary": "Resolved local plugin and /sortie command configuration."
    },
    {
      "check": "/home/rozen/.opencode/bin/opencode run --command sortie",
      "status": "pass",
      "exit_code": 0,
      "summary": "Canonical private workflow completed with the gate active."
    }
  ]
}
